<?xml version="1.0" encoding="UTF-8" standalone="no"?>
<xsd:schema xmlns="http://www.springframework.org/schema/beans" xmlns:xsd="http://www.w3.org/2001/XMLSchema" targetNamespace="http://www.springframework.org/schema/beans">
	<xsd:import namespace="http://www.w3.org/XML/1998/namespace"/>
	<!-- base types -->
	<xsd:complexType name="identifiedType" abstract="true">
		<xsd:attribute name="id" type="xsd:ID"/>
	</xsd:complexType>
	<!-- Top-level <beans> tag -->
	<xsd:element name="beans">
		<xsd:complexType>
			<xsd:sequence>
				<xsd:element ref="description" minOccurs="0"/>
				<xsd:choice minOccurs="0" maxOccurs="unbounded">
					<xsd:element ref="import"/>
					<xsd:element ref="alias"/>
					<xsd:element ref="bean"/>
					<xsd:any namespace="##other" processContents="strict" minOccurs="0" maxOccurs="unbounded"/>
				</xsd:choice>
			</xsd:sequence>
			<xsd:attribute name="default-lazy-init" default="false">
				<xsd:simpleType>
					<xsd:restriction base="xsd:NMTOKEN">
						<xsd:enumeration value="true"/>
						<xsd:enumeration value="false"/>
					</xsd:restriction>
				</xsd:simpleType>
			</xsd:attribute>
			<xsd:attribute name="default-dependency-check" default="none">
				<xsd:simpleType>
					<xsd:restriction base="xsd:NMTOKEN">
						<xsd:enumeration value="none"/>
						<xsd:enumeration value="all"/>
						<xsd:enumeration value="objects"/>
						<xsd:enumeration value="simple"/>
					</xsd:restriction>
				</xsd:simpleType>
			</xsd:attribute>
			<xsd:attribute name="default-autowire" default="no">
				<xsd:simpleType>
					<xsd:restriction base="xsd:NMTOKEN">
						<xsd:enumeration value="byType"/>
						<xsd:enumeration value="byName"/>
						<xsd:enumeration value="no"/>
						<xsd:enumeration value="autodetect"/>
						<xsd:enumeration value="constructor"/>
					</xsd:restriction>
				</xsd:simpleType>
			</xsd:attribute>
			<xsd:attribute name="default-init-method" type="xsd:string" default="-"/>
			<xsd:attribute name="default-destroy-method" type="xsd:string" default="-"/>
		</xsd:complexType>
	</xsd:element>
	<xsd:element name="description">
		<xsd:complexType mixed="true">
			<xsd:choice minOccurs="0" maxOccurs="unbounded"/>
		</xsd:complexType>
	</xsd:element>
	<xsd:element name="import">
		<xsd:complexType>
			<xsd:complexContent>
				<xsd:restriction base="xsd:anyType">
					<xsd:attribute name="resource" type="xsd:string" use="required"/>
				</xsd:restriction>
			</xsd:complexContent>
		</xsd:complexType>
	</xsd:element>
	<xsd:element name="alias">
		<xsd:complexType>
			<xsd:complexContent>
				<xsd:restriction base="xsd:anyType">
					<xsd:attribute name="name" type="xsd:string" use="required"/>
					<xsd:attribute name="alias" type="xsd:string" use="required"/>
				</xsd:restriction>
			</xsd:complexContent>
		</xsd:complexType>
	</xsd:element>
	<xsd:group name="beanElements">
		<xsd:sequence>
			<xsd:element ref="description" minOccurs="0"/>
			<xsd:choice minOccurs="0" maxOccurs="unbounded">
				<xsd:element ref="constructor-arg"/>
				<xsd:element ref="property"/>
				<xsd:element ref="lookup-method"/>
				<xsd:element ref="replaced-method"/>
				<xsd:any namespace="##other" processContents="strict" minOccurs="0" maxOccurs="unbounded"/>
			</xsd:choice>
		</xsd:sequence>
	</xsd:group>
	<!-- definition of an attribute group -->
	<xsd:attributeGroup name="beanAttributes">
		<!--<xsd:attribute name="id" type="xsd:ID"/>-->
		<xsd:attribute name="name" type="xsd:string"/>
		<xsd:attribute name="class" type="xsd:string"/>
		<xsd:attribute name="parent" type="xsd:string"/>
		<xsd:attribute name="abstract" default="false">
			<xsd:simpleType>
				<xsd:restriction base="xsd:NMTOKEN">
					<xsd:enumeration value="true"/>
					<xsd:enumeration value="false"/>
				</xsd:restriction>
			</xsd:simpleType>
		</xsd:attribute>
		<xsd:attribute name="singleton" default="true">
			<xsd:simpleType>
				<xsd:restriction base="xsd:NMTOKEN">
					<xsd:enumeration value="true"/>
					<xsd:enumeration value="false"/>
				</xsd:restriction>
			</xsd:simpleType>
		</xsd:attribute>
		<xsd:attribute name="lazy-init" default="default">
			<xsd:simpleType>
				<xsd:restriction base="xsd:NMTOKEN">
					<xsd:enumeration value="default"/>
					<xsd:enumeration value="true"/>
					<xsd:enumeration value="false"/>
				</xsd:restriction>
			</xsd:simpleType>
		</xsd:attribute>
		<xsd:attribute name="autowire" default="default">
			<xsd:simpleType>
				<xsd:restriction base="xsd:NMTOKEN">
					<xsd:enumeration value="byType"/>
					<xsd:enumeration value="byName"/>
					<xsd:enumeration value="default"/>
					<xsd:enumeration value="no"/>
					<xsd:enumeration value="autodetect"/>
					<xsd:enumeration value="constructor"/>
				</xsd:restriction>
			</xsd:simpleType>
		</xsd:attribute>
		<xsd:attribute name="dependency-check" default="default">
			<xsd:simpleType>
				<xsd:restriction base="xsd:NMTOKEN">
					<xsd:enumeration value="default"/>
					<xsd:enumeration value="none"/>
					<xsd:enumeration value="all"/>
					<xsd:enumeration value="objects"/>
					<xsd:enumeration value="simple"/>
				</xsd:restriction>
			</xsd:simpleType>
		</xsd:attribute>
		<xsd:attribute name="depends-on" type="xsd:string"/>
		<xsd:attribute name="init-method" type="xsd:string"/>
		<xsd:attribute name="destroy-method" type="xsd:string"/>
		<xsd:attribute name="factory-method" type="xsd:string"/>
		<xsd:attribute name="factory-bean" type="xsd:string"/>
		<xsd:anyAttribute namespace="##other" processContents="strict"/>
	</xsd:attributeGroup>
	<!-- the <bean> element -->
	<xsd:element name="bean">
		<xsd:complexType>
			<xsd:complexContent>
				<xsd:extension base="identifiedType">
					<xsd:group ref="beanElements"/>
					<xsd:attributeGroup ref="beanAttributes"/>
				</xsd:extension>
			</xsd:complexContent>
		</xsd:complexType>
	</xsd:element>
	<xsd:element name="constructor-arg">
		<xsd:complexType>
			<xsd:sequence>
				<xsd:element ref="description" minOccurs="0"/>
				<xsd:choice minOccurs="0">
					<xsd:element ref="bean"/>
					<xsd:element ref="ref"/>
					<xsd:element ref="idref"/>
					<xsd:element ref="value"/>
					<xsd:element ref="null"/>
					<xsd:element ref="list"/>
					<xsd:element ref="set"/>
					<xsd:element ref="map"/>
					<xsd:element ref="props"/>
				</xsd:choice>
			</xsd:sequence>
			<xsd:attribute name="index" type="xsd:string"/>
			<xsd:attribute name="type" type="xsd:string"/>
			<xsd:attribute name="ref" type="xsd:string"/>
			<xsd:attribute name="value" type="xsd:string"/>
		</xsd:complexType>
	</xsd:element>
	<xsd:element name="property">
		<xsd:complexType>
			<xsd:sequence>
				<xsd:element ref="description" minOccurs="0"/>
				<xsd:choice minOccurs="0">
					<xsd:element ref="bean"/>
					<xsd:element ref="ref"/>
					<xsd:element ref="idref"/>
					<xsd:element ref="value"/>
					<xsd:element ref="null"/>
					<xsd:element ref="list"/>
					<xsd:element ref="set"/>
					<xsd:element ref="map"/>
					<xsd:element ref="props"/>
					<xsd:any namespace="##other" processContents="strict" minOccurs="0" maxOccurs="unbounded"/>
				</xsd:choice>
			</xsd:sequence>
			<xsd:attribute name="name" type="xsd:string" use="required"/>
			<xsd:attribute name="ref" type="xsd:string"/>
			<xsd:attribute name="value" type="xsd:string"/>
		</xsd:complexType>
	</xsd:element>
	<xsd:element name="lookup-method">
		<xsd:complexType>
			<xsd:complexContent>
				<xsd:restriction base="xsd:anyType">
					<xsd:attribute name="name" type="xsd:string"/>
					<xsd:attribute name="bean" type="xsd:string"/>
				</xsd:restriction>
			</xsd:complexContent>
		</xsd:complexType>
	</xsd:element>
	<xsd:element name="replaced-method">
		<xsd:complexType>
			<xsd:sequence>
				<xsd:choice minOccurs="0" maxOccurs="unbounded">
					<xsd:element ref="arg-type"/>
				</xsd:choice>
			</xsd:sequence>
			<xsd:attribute name="name" type="xsd:string"/>
			<xsd:attribute name="replacer" type="xsd:string"/>
		</xsd:complexType>
	</xsd:element>
	<xsd:element name="arg-type">
		<xsd:complexType mixed="true">
			<xsd:choice minOccurs="0" maxOccurs="unbounded"/>
			<xsd:attribute name="match" type="xsd:string"/>
		</xsd:complexType>
	</xsd:element>
	<xsd:element name="ref">
		<xsd:complexType>
			<xsd:complexContent>
				<xsd:restriction base="xsd:anyType">
					<xsd:attribute name="bean" type="xsd:string"/>
					<xsd:attribute name="local" type="xsd:IDREF"/>
					<xsd:attribute name="parent" type="xsd:string"/>
				</xsd:restriction>
			</xsd:complexContent>
		</xsd:complexType>
	</xsd:element>
	<xsd:element name="idref">
		<xsd:complexType>
			<xsd:complexContent>
				<xsd:restriction base="xsd:anyType">
					<xsd:attribute name="bean" type="xsd:string"/>
					<xsd:attribute name="local" type="xsd:IDREF"/>
				</xsd:restriction>
			</xsd:complexContent>
		</xsd:complexType>
	</xsd:element>
	<xsd:element name="value">
		<xsd:complexType mixed="true">
			<xsd:choice minOccurs="0" maxOccurs="unbounded"/>
			<xsd:attribute name="type" type="xsd:string"/>
		</xsd:complexType>
	</xsd:element>
	<xsd:element name="null">
		<xsd:complexType mixed="true">
			<xsd:choice minOccurs="0" maxOccurs="unbounded"/>
		</xsd:complexType>
	</xsd:element>
	<!-- Collection Elements -->
	<xsd:element name="list">
		<xsd:complexType>
			<xsd:sequence>
				<xsd:choice minOccurs="0" maxOccurs="unbounded">
					<xsd:element ref="bean"/>
					<xsd:element ref="ref"/>
					<xsd:element ref="idref"/>
					<xsd:element ref="value"/>
					<xsd:element ref="null"/>
					<xsd:element ref="list"/>
					<xsd:element ref="set"/>
					<xsd:element ref="map"/>
					<xsd:element ref="props"/>
				</xsd:choice>
			</xsd:sequence>
		</xsd:complexType>
	</xsd:element>
	<xsd:element name="set">
		<xsd:complexType>
			<xsd:sequence>
				<xsd:choice minOccurs="0" maxOccurs="unbounded">
					<xsd:element ref="bean"/>
					<xsd:element ref="ref"/>
					<xsd:element ref="idref"/>
					<xsd:element ref="value"/>
					<xsd:element ref="null"/>
					<xsd:element ref="list"/>
					<xsd:element ref="set"/>
					<xsd:element ref="map"/>
					<xsd:element ref="props"/>
				</xsd:choice>
			</xsd:sequence>
		</xsd:complexType>
	</xsd:element>
	<xsd:element name="map" type="mapType"/>
	<xsd:element name="entry" type="entryType"/>
	<xsd:element name="key">
		<xsd:complexType>
			<xsd:sequence>
				<xsd:choice>
					<xsd:element ref="bean"/>
					<xsd:element ref="ref"/>
					<xsd:element ref="idref"/>
					<xsd:element ref="value"/>
					<xsd:element ref="null"/>
					<xsd:element ref="list"/>
					<xsd:element ref="set"/>
					<xsd:element ref="map"/>
					<xsd:element ref="props"/>
				</xsd:choice>
			</xsd:sequence>
		</xsd:complexType>
	</xsd:element>
	<xsd:element name="props">
		<xsd:complexType>
			<xsd:sequence>
				<xsd:choice minOccurs="0" maxOccurs="unbounded">
					<xsd:element ref="prop"/>
				</xsd:choice>
			</xsd:sequence>
		</xsd:complexType>
	</xsd:element>
	<xsd:element name="prop">
		<xsd:complexType mixed="true">
			<xsd:choice minOccurs="0" maxOccurs="unbounded"/>
			<xsd:attribute name="key" type="xsd:string" use="required"/>
		</xsd:complexType>
	</xsd:element>
	<!-- Collection Types -->
	<xsd:complexType name="mapType">
		<xsd:sequence>
			<xsd:choice minOccurs="0" maxOccurs="unbounded">
				<xsd:element ref="entry"/>
			</xsd:choice>
		</xsd:sequence>
	</xsd:complexType>
	<xsd:complexType name="entryType">
		<xsd:sequence>
			<xsd:element ref="key" minOccurs="0"/>
			<xsd:choice minOccurs="0">
				<xsd:element ref="bean"/>
				<xsd:element ref="ref"/>
				<xsd:element ref="idref"/>
				<xsd:element ref="value"/>
				<xsd:element ref="null"/>
				<xsd:element ref="list"/>
				<xsd:element ref="set"/>
				<xsd:element ref="map"/>
				<xsd:element ref="props"/>
			</xsd:choice>
		</xsd:sequence>
		<xsd:attribute name="key" type="xsd:string"/>
		<xsd:attribute name="key-ref" type="xsd:string"/>
		<xsd:attribute name="value" type="xsd:string"/>
		<xsd:attribute name="value-ref" type="xsd:string"/>
	</xsd:complexType>
</xsd:schema>
